<?xml version="1.0" encoding="UTF-8"?>
<!DOCTYPE project PUBLIC "quokka.ws/dtd/project-1.0-m01" "http://quokka.ws/dtd/project-1.0-m01.dtd">

<project name="core.plugin-spi">
    <artifacts group="quokka.core.plugin-spi" version="1.0-m01-ss">
        <artifact/>
    </artifacts>

    <dependency-set>
        <dependency group="quokka.core.bootstrap-util" version="1.0-m01-ss" paths="compile, runtime"/>
        <dependency group="quokka.core.version" version="1.0-m01-ss" paths="compile, runtime"/>

        <dependency group="quokka.core.test" version="1.0-m01-ss" paths="test-compile"/>
        <dependency group="junit" version="3.8.1" paths="test-compile"/>
        <dependency group="apache.ant" version="1.7.0" paths="compile"/>
        <dependency-set group="quokka.internal.module-depset" version="1.0-m01-ss"/>
    </dependency-set>
</project>
